Keyword,Search Volume (monthly),CPC (USD),Competition Level,Keyword Difficulty,Search Intent,Trend (yearly %),Category
diseño de páginas web,2400,1.54,LOW,73,navigational,-16,Core Service
diseño de pagina web en lima,390,1.56,LOW,98,commercial/navigational,52,Local - Lima
diseño de páginas web en lima,390,1.56,LOW,90,commercial/navigational,52,Local - Lima
diseño de paginas web en lima,390,1.56,LOW,90,commercial/navigational,52,Local - Lima
cómo crear una página web para mi negocio,210,1.69,HIGH,47,navigational/commercial,-33,Buyer Intent
como crear una página web para mi negocio,210,1.69,HIGH,74,commercial/navigational,-33,Buyer Intent
pagina web peru,210,0.93,MEDIUM,73,navigational,-56,Local - Peru
pagina web en peru,210,0.93,MEDIUM,73,navigational,-56,Local - Peru
diseño web lima,170,0.84,LOW,72,commercial,-50,Local - Lima
diseño web en lima,170,0.84,LOW,100,commercial,-50,Local - Lima
diseño de pagina web peru,90,1.24,MEDIUM,100,navigational,,Local - Peru
como crear una página web gratis para mi negocio,70,0.99,HIGH,,navigational/commercial,-57,Buyer Intent
como crear una página web para mi negocio gratis,70,0.99,HIGH,,navigational/commercial,-57,Buyer Intent
curso de diseño de páginas web,70,1.06,HIGH,53,navigational,-43,Education
empresa de diseño de páginas web,50,4.26,LOW,100,navigational,250,Commercial Intent
diseño de pagina web lima,50,1.89,LOW,,navigational,,Local - Lima
diseño de paginas web lima,50,1.89,LOW,100,commercial,,Local - Lima
cuanto cuesta una pagina web peru,50,0.65,MEDIUM,,navigational/commercial,33,Pricing
cuanto cuesta una pagina web en peru,50,0.65,MEDIUM,,navigational/commercial,33,Pricing
diseño de páginas web gratis,40,1.20,MEDIUM,,navigational,-25,Free Solutions
diseño y desarrollo de páginas web,40,1.10,MEDIUM,,navigational,-71,Core Service
desarrollo y diseño de páginas web,40,1.10,MEDIUM,,navigational,-71,Core Service
desarrollador web freelance,30,0.42,LOW,47,navigational/commercial,-33,Freelance
cuanto cuesta hacer una pagina web peru,30,0.21,HIGH,49,navigational/commercial,-67,Pricing
cuanto cuesta hacer una pagina web en peru,30,0.21,HIGH,49,navigational/commercial,-67,Pricing
creacion de pagina web peru,30,1.60,HIGH,,navigational,,Local - Peru
diseño de páginas web profesionales,30,,MEDIUM,95,navigational/commercial,,Professional
diseño de páginas web profesional,30,,MEDIUM,,navigational/commercial,,Professional
diseño de páginas web precios,20,1.21,HIGH,,navigational,,Pricing
diseño de páginas web precio,20,1.21,HIGH,,navigational,,Pricing
diseño de páginas web con wordpress,20,3.33,LOW,55,navigational,,WordPress
servicio de diseño de páginas web,20,,LOW,,navigational,100,Service
precio de pagina web en peru,20,0.87,MEDIUM,,navigational/commercial,100,Pricing
precio pagina web peru,20,0.84,HIGH,,navigational,,Pricing
pagina web precio peru,20,0.84,HIGH,50,navigational,,Pricing
crear pagina web peru,20,0.74,HIGH,,navigational,,Local - Peru
pagina web lima peru,20,1.10,HIGH,,navigational,-67,Local - Lima
cuanto cuesta crear una pagina web peru,20,1.00,HIGH,50,navigational/commercial,-50,Pricing
como hacer una pagina web gratis para mi negocio,20,1.28,HIGH,,navigational/commercial,,Buyer Intent
como hacer una pagina web para mi negocio gratis,20,1.28,HIGH,,navigational/commercial,,Buyer Intent
donde estudiar diseño web en lima,20,1.50,HIGH,,commercial,100,Education
diseño de páginas web en perú,10,,,,navigational,,Local - Peru
diseño de páginas web en arequipa,10,,,100,commercial,,Local - Arequipa
empresa de diseño de páginas web perú,10,,,,navigational,,Local - Peru
diseño de páginas web para hoteles,10,,,,navigational,,Niche - Hotels
diseño de páginas web corporativas,10,,,,commercial/navigational,,Niche - Corporate
diseño de páginas web para inmobiliarias,10,,,,commercial/navigational,,Niche - Real Estate
diseño de páginas web económicas,10,,,52,navigational/commercial,,Budget
diseño de páginas web wordpress,10,,LOW,55,navigational,,WordPress
diseño y programación de páginas web,10,,LOW,,navigational,,Core Service
diseño de páginas web html,10,0.75,LOW,,navigational,,Technical
empresas de diseño de páginas web,10,,LOW,100,navigational,,Commercial Intent
diseño de paginas web en lima peru,10,,MEDIUM,,navigational/commercial,,Local - Lima Peru
diseño paginas web lima,10,0.61,LOW,100,navigational,,Local - Lima
diseño paginas web en lima,10,0.61,LOW,100,navigational,,Local - Lima
diseño web wordpress lima,10,,LOW,,navigational,,WordPress Local
agencia de diseño web en lima,10,,LOW,,commercial,,Agency
empresa de diseño web en lima,10,,,,commercial,,Agency
empresas de diseño web en lima,10,,,,commercial,,Agency
diseño web lima peru,10,0.44,MEDIUM,,navigational/commercial,,Local - Lima Peru
diseño de paginas web lima peru,10,,,,navigational/commercial,,Local - Lima Peru
como hacer una pagina web para mi negocio,10,1.14,HIGH,,navigational/commercial,,Buyer Intent
quiero hacer una pagina web para mi negocio,10,,LOW,,navigational/commercial,,Buyer Intent
como hacer una pagina web para mi negocio en google,10,,MEDIUM,,navigational/commercial,,Buyer Intent
crear página web para mi negocio gratis,10,2.11,HIGH,,navigational,,Buyer Intent
busco desarrollador web freelance,10,,LOW,,navigational/commercial,,Freelance
diseño de páginas web carrera,10,,HIGH,,navigational/commercial,,Education
cursos de diseño de páginas web gratis,10,,,,navigational,,Education Free
